23:03:03.995091 IP 192.168.178.10.32508 > dns.mnd.iss.as9143.net.domain: 39998+ A? www.ufcg.edu.br. (33)
23:03:04.658524 IP dns.mnd.iss.as9143.net.domain > 192.168.178.10.32508: 39998 1/2/2 A 150.165.111.230 (143)
23:03:04.658674 IP 192.168.178.10.4478 > dns.tb.iss.as9143.net.domain: 6864+ A? www.ufcg.edu.br. (33)
23:03:05.083962 IP dns.tb.iss.as9143.net.domain > 192.168.178.10.4478: 6864 1/2/2 A 150.165.111.230 (143)
23:03:05.189931 IP 192.168.178.10.64569 > dns.mnd.iss.as9143.net.domain: 40640+ A? secure.screenhero.com. (39)
23:03:05.202467 IP dns.mnd.iss.as9143.net.domain > 192.168.178.10.64569: 40640 4/4/0 A 54.88.165.232, A 54.164.219.148, A 54.210.224.169, A 54.208.178.115 (240)
23:03:05.215968 IP 192.168.178.10.58027 > dns.mnd.iss.as9143.net.domain: 55456+ A? www.brasil.gov.br. (35)
23:03:05.216132 IP 192.168.178.10.40191 > dns.mnd.iss.as9143.net.domain: 23877+ A? www.cgu.gov.br. (32)
23:03:05.228388 IP dns.mnd.iss.as9143.net.domain > 192.168.178.10.40191: 23877 1/2/2 A 189.16.231.243 (116)
23:03:05.607865 IP dns.mnd.iss.as9143.net.domain > 192.168.178.10.58027: 55456 1/3/0 A 161.148.175.40 (130)
23:03:05.920308 IP 192.168.178.10.61497 > dns.mnd.iss.as9143.net.domain: 2746+ A? d3hb26arjl8wb7.cloudfront.net. (47)
23:03:06.214664 IP dns.mnd.iss.as9143.net.domain > 192.168.178.10.61497: 2746 8/4/0 A 54.230.130.4, A 54.230.129.217, A 54.230.130.94, A 54.230.131.161, A 54.230.131.135, A 54.230.129.46, A 54.240.184.74, A 54.230.130.14 (312)
23:03:07.853703 IP 192.168.178.10.23219 > dns.mnd.iss.as9143.net.domain: 37656+ A? mail.ufcg.edu.br. (34)
23:03:07.853794 IP 192.168.178.10.26799 > dns.mnd.iss.as9143.net.domain: 26157+ A? pre.sti.ufcg.edu.br. (37)
23:03:07.853877 IP 192.168.178.10.46694 > dns.mnd.iss.as9143.net.domain: 43211+ A? twitter.com. (29)
23:03:07.866309 IP dns.mnd.iss.as9143.net.domain > 192.168.178.10.46694: 43211 12/4/0 A 199.59.149.230, A 199.16.156.230, A 199.16.156.70, A 199.16.156.102, A 199.16.156.38, A 199.59.150.7, A 199.16.156.6, A 199.59.148.82, A 199.59.149.198, A 199.59.150.39, A 199.16.156.198, A 199.59.148.10 (307)
23:03:07.937701 IP 192.168.178.10.44928 > dns.mnd.iss.as9143.net.domain: 34073+ A? capacitacaoufcg.blogspot.com.br. (49)
23:03:07.965305 IP dns.mnd.iss.as9143.net.domain > 192.168.178.10.44928: 34073 2/0/0 CNAME blogspot.l.googleusercontent.com., A 173.194.65.132 (111)
23:03:07.966156 IP 192.168.178.10.11480 > dns.mnd.iss.as9143.net.domain: 42848+ A? ccbs.ufcg.edu.br. (34)
23:03:08.207823 IP dns.mnd.iss.as9143.net.domain > 192.168.178.10.26799: 26157 1/1/1 A 150.165.111.232 (86)
23:03:08.208127 IP 192.168.178.10.cawas > dns.mnd.iss.as9143.net.domain: 11929+ A? cct.ufcg.edu.br. (33)
23:03:08.412445 IP dns.mnd.iss.as9143.net.domain > 192.168.178.10.cawas: 11929 1/2/3 A 150.165.86.253 (147)
23:03:08.412755 IP 192.168.178.10.46431 > dns.mnd.iss.as9143.net.domain: 54786+ A? extensao.ufcg.edu.br. (38)
23:03:08.565174 IP 192.168.178.10.37985 > dns.tb.iss.as9143.net.domain: 57474+ A? mail.ufcg.edu.br. (34)
23:03:08.678501 IP 192.168.178.10.39968 > dns.tb.iss.as9143.net.domain: 53198+ A? ccbs.ufcg.edu.br. (34)
23:03:08.762758 IP dns.mnd.iss.as9143.net.domain > 192.168.178.10.46431: 54786 1/2/2 A 150.165.111.213 (148)
23:03:08.763320 IP 192.168.178.10.here-lm > dns.mnd.iss.as9143.net.domain: 57561+ A? lattes.cnpq.br. (32)
23:03:08.784031 IP dns.tb.iss.as9143.net.domain > 192.168.178.10.37985: 57474 1/2/2 A 150.165.111.253 (144)
23:03:08.784466 IP 192.168.178.10.21081 > dns.mnd.iss.as9143.net.domain: 20774+ A? prac.ufcg.edu.br. (34)
23:03:08.895312 IP dns.tb.iss.as9143.net.domain > 192.168.178.10.39968: 53198 1/2/2 A 150.165.111.213 (144)
23:03:08.895565 IP 192.168.178.10.9185 > dns.mnd.iss.as9143.net.domain: 23451+ A? propex.ufcg.edu.br. (36)
23:03:08.920612 IP dns.mnd.iss.as9143.net.domain > 192.168.178.10.11480: 42848 1/2/2 A 150.165.111.213 (144)
23:03:09.403793 IP dns.mnd.iss.as9143.net.domain > 192.168.178.10.here-lm: 57561 2/2/2 CNAME grupo-lattes.cnpq.br., A 200.130.33.27 (145)
23:03:09.496524 IP 192.168.178.10.64093 > dns.tb.iss.as9143.net.domain: 15547+ A? prac.ufcg.edu.br. (34)
23:03:09.606825 IP 192.168.178.10.7062 > dns.tb.iss.as9143.net.domain: 30945+ A? propex.ufcg.edu.br. (36)
23:03:09.814560 IP dns.tb.iss.as9143.net.domain > 192.168.178.10.7062: 30945 1/2/2 A 150.165.111.213 (146)
23:03:09.859739 IP dns.tb.iss.as9143.net.domain > 192.168.178.10.64093: 15547 1/2/2 A 150.165.111.213 (144)
23:03:10.555851 IP dns.mnd.iss.as9143.net.domain > 192.168.178.10.23219: 37656 1/2/2 A 150.165.111.253 (144)
23:03:11.440124 IP dns.mnd.iss.as9143.net.domain > 192.168.178.10.21081: 20774 1/2/2 A 150.165.111.213 (144)
23:03:12.668994 IP dns.mnd.iss.as9143.net.domain > 192.168.178.10.9185: 23451 1/2/2 A 150.165.111.213 (146)
